question,answer,rubi,choices,description
"日本で最も高い山はどれ？","富士山","ふじさん","北岳;奥穂高岳;間ノ岳","富士山は標高3,776メートルで日本最高峰です。"
"1万円札の肖像画に描かれている人物は？（2024年発行の新紙幣）","渋沢栄一","しぶさわえいいち","福沢諭吉;樋口一葉;野口英世","2024年からの新札では「日本資本主義の父」渋沢栄一が採用されました。"
"太陽系で最も大きい惑星はどれ？","木星","もくせい","土星;天王星;海王星","木星は太陽系最大の惑星で、直径は地球の約11倍あります。"
"日本の現在の年号は何？","令和","れいわ","平成;昭和;大正","2019年5月1日から始まった現在の元号です。"
"世界で最も広い面積を持つ国はどこ？","ロシア","ろしあ","カナダ;アメリカ;中国","ロシアは日本の約45倍、世界最大の面積を誇ります。"
"原子番号1番の元素は何？","水素","すいそ","ヘリウム;リチウム;酸素","水素（H）は宇宙で最も多く存在する元素です。"
"「羅生門」や「鼻」などの短編小説で知られる日本の作家は誰？","芥川龍之介","あくたがわりゅうのすけ","夏目漱石;太宰治;三島由紀夫","大正時代を代表する文豪の一人です。"
"地球の表面の約何％が海で覆われている？","約70%","やくななじゅっぱーせんと","約50%;約30%;約90%","地球は「水の惑星」と呼ばれ、表面の大部分が海です。"
"日本の国技とされているスポーツは何？","相撲","すもう","柔道;剣道;空手","古事記や日本書紀にも登場する、日本古来の競技です。"
"1時間を秒に直すと何秒？","3600秒","さんぜんろっぴゃくびょう","60秒;600秒;360秒","60分×60秒で、合計3,600秒となります。"
